{
  "meta": {
    "version": 1,
    "lastAudit": "2026-06-28T15:48:24.992Z",
    "generatedBy": "audit-refs.ts",
    "totalRefs": 37
  },
  "groups": [
    {
      "id": "bun-b01-b08",
      "title": "Bun docs",
      "prefix": "B"
    },
    {
      "id": "effect-e01-e05",
      "title": "Effect docs",
      "prefix": "E"
    },
    {
      "id": "grammy-telegram-t01-t05",
      "title": "grammY & Telegram",
      "prefix": "T"
    },
    {
      "id": "google-sheets-s01-s05",
      "title": "Google Sheets",
      "prefix": "S"
    },
    {
      "id": "internal-spec-sections",
      "title": "Spec sections",
      "prefix": "SPEC"
    },
    {
      "id": "project-documents",
      "title": "Project documents",
      "prefix": "DOC"
    }
  ],
  "refs": [
    {
      "id": "B01",
      "prefix": "B",
      "topic": "Runtime overview",
      "url": "https://bun.com/docs",
      "urlLabel": "bun.com/docs",
      "anchor": "ref-b01",
      "group": "bun-b01-b08",
      "projectUse": "TypeScript runtime and tooling",
      "kind": "external",
      "sidebarLabel": "Overview",
      "tags": [
        "bun",
        "core"
      ],
      "deprecated": false,
      "replacedBy": null,
      "lastChecked": "2026-06-28T15:48:24.992Z",
      "status": "ok"
    },
    {
      "id": "B02",
      "prefix": "B",
      "topic": "TypeScript & types",
      "url": "https://bun.com/docs/runtime/typescript",
      "urlLabel": "Runtime → TypeScript",
      "anchor": "ref-b02",
      "group": "bun-b01-b08",
      "projectUse": "bun-types, strict typing",
      "kind": "external",
      "sidebarLabel": "TypeScript",
      "tags": [
        "bun",
        "core"
      ],
      "deprecated": false,
      "replacedBy": null,
      "lastChecked": "2026-06-28T15:48:24.992Z",
      "status": "ok"
    },
    {
      "id": "B03",
      "prefix": "B",
      "topic": "HTTP server (Bun.serve)",
      "url": "https://bun.com/docs/api/http",
      "urlLabel": "API → HTTP",
      "anchor": "ref-b03",
      "group": "bun-b01-b08",
      "projectUse": "Telegram webhook endpoint",
      "kind": "external",
      "sidebarLabel": "Bun.serve",
      "tags": [
        "bun",
        "http",
        "webhook",
        "core"
      ],
      "deprecated": false,
      "replacedBy": null,
      "lastChecked": "2026-06-28T15:48:24.992Z",
      "status": "ok"
    },
    {
      "id": "B04",
      "prefix": "B",
      "topic": "Cron (Bun.cron)",
      "url": "https://bun.com/docs/runtime/cron",
      "urlLabel": "Runtime → Cron",
      "anchor": "ref-b04",
      "group": "bun-b01-b08",
      "projectUse": "Daily summary, integrity check",
      "kind": "external",
      "sidebarLabel": "Bun.cron",
      "tags": [
        "bun",
        "cron",
        "scheduled",
        "core"
      ],
      "deprecated": false,
      "replacedBy": null,
      "lastChecked": "2026-06-28T15:48:24.992Z",
      "status": "ok"
    },
    {
      "id": "B05",
      "prefix": "B",
      "topic": "Environment (Bun.env)",
      "url": "https://bun.com/docs/runtime/env",
      "urlLabel": "Runtime → Env",
      "anchor": "ref-b05",
      "group": "bun-b01-b08",
      "projectUse": "Bot token, sheet ID, cache TTL",
      "kind": "external",
      "sidebarLabel": "Bun.env",
      "tags": [
        "bun",
        "core"
      ],
      "deprecated": false,
      "replacedBy": null,
      "lastChecked": "2026-06-28T15:48:24.992Z",
      "status": "ok"
    },
    {
      "id": "B06",
      "prefix": "B",
      "topic": "File I/O (Bun.file)",
      "url": "https://bun.com/docs/api/file-io",
      "urlLabel": "API → File I/O",
      "anchor": "ref-b06",
      "group": "bun-b01-b08",
      "projectUse": "Config JSON, service-account file",
      "kind": "external",
      "sidebarLabel": "Bun.file",
      "tags": [
        "bun",
        "storage"
      ],
      "deprecated": false,
      "replacedBy": null,
      "lastChecked": "2026-06-28T15:48:24.992Z",
      "status": "ok"
    },
    {
      "id": "B07",
      "prefix": "B",
      "topic": "Package manager",
      "url": "https://bun.com/docs/pm/cli/install",
      "urlLabel": "install",
      "anchor": "ref-b07",
      "group": "bun-b01-b08",
      "projectUse": "Dependency setup (future)",
      "kind": "external",
      "sidebarLabel": "install",
      "tags": [
        "bun"
      ],
      "deprecated": false,
      "replacedBy": null,
      "lastChecked": "2026-06-28T15:48:24.992Z",
      "status": "ok"
    },
    {
      "id": "B08",
      "prefix": "B",
      "topic": "Test runner",
      "url": "https://bun.com/docs/test",
      "urlLabel": "Test runner",
      "anchor": "ref-b08",
      "group": "bun-b01-b08",
      "projectUse": "Unit/integration tests (future)",
      "kind": "external",
      "sidebarLabel": "Test runner",
      "tags": [
        "bun"
      ],
      "deprecated": false,
      "replacedBy": null,
      "lastChecked": "2026-06-28T15:48:24.992Z",
      "status": "ok"
    },
    {
      "id": "E01",
      "prefix": "E",
      "topic": "Overview",
      "url": "https://effect.website/docs",
      "urlLabel": "effect.website/docs",
      "anchor": "ref-e01",
      "group": "effect-e01-e05",
      "projectUse": "Typed services, error handling",
      "kind": "external",
      "sidebarLabel": "Overview",
      "tags": [
        "effect",
        "core"
      ],
      "deprecated": false,
      "replacedBy": null,
      "lastChecked": "2026-06-28T15:48:24.992Z",
      "status": "ok"
    },
    {
      "id": "E02",
      "prefix": "E",
      "topic": "Schema",
      "url": "https://effect.website/docs/schema/introduction/",
      "urlLabel": "Schema introduction",
      "anchor": "ref-e02",
      "group": "effect-e01-e05",
      "projectUse": "Command + config validation",
      "kind": "external",
      "sidebarLabel": "Schema",
      "tags": [
        "effect",
        "validation",
        "core"
      ],
      "deprecated": false,
      "replacedBy": null,
      "lastChecked": "2026-06-28T15:48:24.992Z",
      "status": "ok"
    },
    {
      "id": "E03",
      "prefix": "E",
      "topic": "Layers & services",
      "url": "https://effect.website/docs/requirements-management/layers",
      "urlLabel": "Requirements management",
      "anchor": "ref-e03",
      "group": "effect-e01-e05",
      "projectUse": "ConfigService, SheetApiService",
      "kind": "external",
      "sidebarLabel": "Layers",
      "tags": [
        "effect",
        "core"
      ],
      "deprecated": false,
      "replacedBy": null,
      "lastChecked": "2026-06-28T15:48:24.992Z",
      "status": "ok"
    },
    {
      "id": "E04",
      "prefix": "E",
      "topic": "Retry",
      "url": "https://effect.website/docs/error-management/retrying",
      "urlLabel": "Retrying",
      "anchor": "ref-e04",
      "group": "effect-e01-e05",
      "projectUse": "Cron failure recovery",
      "kind": "external",
      "sidebarLabel": "Retry",
      "tags": [
        "effect",
        "cron"
      ],
      "deprecated": false,
      "replacedBy": null,
      "lastChecked": "2026-06-28T15:48:24.992Z",
      "status": "ok"
    },
    {
      "id": "E05",
      "prefix": "E",
      "topic": "Effect.gen",
      "url": "https://effect.website/docs/getting-started/introduction",
      "urlLabel": "Getting started",
      "anchor": "ref-e05",
      "group": "effect-e01-e05",
      "projectUse": "Cron workflows, handlers",
      "kind": "external",
      "sidebarLabel": "Effect.gen",
      "tags": [
        "effect",
        "core"
      ],
      "deprecated": false,
      "replacedBy": null,
      "lastChecked": "2026-06-28T15:48:24.992Z",
      "status": "ok"
    },
    {
      "id": "T01",
      "prefix": "T",
      "topic": "grammY guide",
      "url": "https://grammy.dev/guide/",
      "urlLabel": "grammy.dev/guide",
      "anchor": "ref-t01",
      "group": "grammy-telegram-t01-t05",
      "projectUse": "Bot setup, command routing",
      "kind": "external",
      "sidebarLabel": "grammY guide",
      "tags": [
        "grammy",
        "telegram",
        "core"
      ],
      "deprecated": false,
      "replacedBy": null,
      "lastChecked": "2026-06-28T15:48:24.992Z",
      "status": "ok"
    },
    {
      "id": "T02",
      "prefix": "T",
      "topic": "Webhooks",
      "url": "https://grammy.dev/guide/deployment-types.html",
      "urlLabel": "Deployment — Webhooks",
      "anchor": "ref-t02",
      "group": "grammy-telegram-t01-t05",
      "projectUse": "Webhook via B03",
      "kind": "external",
      "sidebarLabel": "Webhooks",
      "tags": [
        "grammy",
        "telegram",
        "webhook"
      ],
      "deprecated": false,
      "replacedBy": null,
      "lastChecked": "2026-06-28T15:48:24.992Z",
      "status": "ok"
    },
    {
      "id": "T03",
      "prefix": "T",
      "topic": "Inline keyboards",
      "url": "https://grammy.dev/plugins/keyboard.html",
      "urlLabel": "Keyboard plugin",
      "anchor": "ref-t03",
      "group": "grammy-telegram-t01-t05",
      "projectUse": "Big-ticket Confirm/Cancel",
      "kind": "external",
      "sidebarLabel": "Keyboards",
      "tags": [
        "grammy",
        "telegram",
        "ui",
        "core"
      ],
      "deprecated": false,
      "replacedBy": null,
      "lastChecked": "2026-06-28T15:48:24.992Z",
      "status": "ok"
    },
    {
      "id": "T04",
      "prefix": "T",
      "topic": "Forum topics",
      "url": "https://core.telegram.org/bots/api#forum-topic-edited",
      "urlLabel": "Bot API — forum topics",
      "anchor": "ref-t04",
      "group": "grammy-telegram-t01-t05",
      "projectUse": "message_thread_id mapping",
      "kind": "external",
      "sidebarLabel": "Forum topics",
      "tags": [
        "telegram",
        "core"
      ],
      "deprecated": false,
      "replacedBy": null,
      "lastChecked": "2026-06-28T15:48:24.992Z",
      "status": "ok"
    },
    {
      "id": "T05",
      "prefix": "T",
      "topic": "Bot API",